Category,Date,Title,Source,Link,Sentiment
news,2024-10-28 16:43:00,Alphabet Q3 earnings preview: AI updates in focus amid Big Tech's spending spree,Yahoo Finance,https://finance.yahoo.com/news/alphabet-q3-earnings-preview-ai-updates-in-focus-amid-big-techs-spending-spree-204342707.html,1.698
news,2024-10-28 16:06:00,"So Far, Earnings Have Been So-So. Can the Mag Seven Turn Things Around?",Investopedia,https://www.investopedia.com/can-big-tech-turn-around-a-so-so-earnings-season-8735384,5
news,2024-10-28 14:53:00,NVDA Stock: Will Nvidias AI Bet Continue to Pay Off in 2025?,Insider Monkey,https://finance.yahoo.com/news/nvda-stock-nvidia-ai-bet-185336991.html,5
news,2024-10-28 14:38:00,"These Stocks Are Moving the Most Today: Boeing, APA, Ford, Nvidia, Philips, ON Semi, McDonalds, Procept BioRobotics, and More",Barrons.com,https://finance.yahoo.com/m/17b24468-2dc2-3f34-b46f-c05f9dbcc731/these-stocks-are-moving-the.html,0.296
news,2024-10-28 13:01:00,AMD to report Q3 earnings as AI takes center stage again,Yahoo Finance,https://finance.yahoo.com/news/amd-to-report-q3-earnings-as-ai-takes-center-stage-again-170138662.html,-0.517
news,2024-10-28 11:34:00,"Nvidia Taps India's Growing AI Market, Partnering with Tech Giants and Scaling Data Centers",Benzinga,https://finance.yahoo.com/news/nvidia-taps-indias-growing-ai-153434353.html,3.787
news,2024-10-28 11:00:00,"NVIDIA Ethernet Networking Accelerates World's Largest AI Supercomputer, Built by xAI",GlobeNewswire,https://www.globenewswire.com/news-release/2024/10/28/2970195/0/en/NVIDIA-Ethernet-Networking-Accelerates-World-s-Largest-AI-Supercomputer-Built-by-xAI.html,-1.118
news,2024-10-28 09:02:00,Is NVIDIA (NVDA) The Best Performing Large-Cap Stock in the Last 3 Years?,Insider Monkey,https://finance.yahoo.com/news/nvidia-nvda-best-performing-large-130212301.html,3.796
news,2024-10-28 08:49:00,AMD gains as Northland says share gains likely to continue,Investing.com,https://finance.yahoo.com/news/amd-gains-northland-says-share-124919344.html,5
news,2024-10-28 05:44:00,Nvidia Has Lots Riding on This Week Even as Earnings a Month Out,Bloomberg,https://finance.yahoo.com/news/nvidia-lots-riding-week-even-094451841.html,5
news,2024-10-27 23:31:00,Is NVIDIA (NVDA) Leading Quantum Computing with CUDA-Q?,Insider Monkey,https://finance.yahoo.com/news/nvidia-nvda-leading-quantum-computing-033141346.html,-0.405
news,2024-10-27 22:33:00,Intel Stock Price Levels to Watch as Struggling Chipmaker's Earnings Loom,Investopedia,https://www.investopedia.com/intel-stock-price-levels-as-struggling-chipmakers-earnings-loom-8735084,0.278
news,2024-10-27 17:00:00,How a Mumbai Drugmaker Is Helping Putin Get Nvidia AI Chips,Bloomberg,https://finance.yahoo.com/news/mumbai-drugmaker-helping-putin-nvidia-210019312.html,3.086
news,2024-10-27 10:30:00,One chart shows how AI will drive another decade of US stock market dominance,Yahoo Finance,https://finance.yahoo.com/news/one-chart-shows-how-ai-will-drive-another-decade-of-us-stock-market-dominance-143042242.html,0.993
news,2024-10-27 10:17:00,Nvidia Stocks (NVDA) Sky-High Valuation: What is Priced In?,Insider Monkey,https://finance.yahoo.com/news/nvidia-stock-nvda-sky-high-141750030.html,4.495
news,2024-10-27 09:00:00,Magnificent 7 shake-up: Why Wall Street is reassessing Tesla's position and looking toward Netflix,Yahoo Finance,https://finance.yahoo.com/news/magnificent-7-shake-up-why-wall-street-is-reassessing-teslas-position-and-looking-toward-netflix-130053237.html,3.098
news,2024-10-27 09:00:00,Big Tech Stocks Lose Some of Their Aura as Earnings Growth Slows,Bloomberg,https://finance.yahoo.com/news/big-tech-stocks-lose-aura-130000736.html,5
news,2024-10-27 08:30:00,From Nvidia to nuclear power to extra spicy hot sauce,Yahoo Finance,https://finance.yahoo.com/news/from-nvidia-to-nuclear-power-to-extra-spicy-hot-sauce-123010664.html,3.092
news,2024-10-27 03:00:00,Intel Stock Needs an Nvidia-Like Run to Save the CEOs Stock Awards,Barrons.com,https://finance.yahoo.com/m/5b90b04a-4abd-37c7-8416-af97da9f1f15/intel-stock-needs-an.html,0.459
news,2024-10-26 06:00:00,Chart of the Week: Taking a closer look at the Magnificent Seven,Yahoo Finance,https://finance.yahoo.com/news/chart-of-the-week-taking-a-closer-look-at-the-magnificent-seven-100014792.html,3.087
news,2024-10-26 03:01:00,Why Caution Is Warranted Ahead of Palantirs (NYSE:PLTR) Q3 Earnings,TipRanks,https://finance.yahoo.com/news/why-caution-warranted-ahead-palantir-070144587.html,5
news,2024-10-25 18:43:00,"Jim Cramer on NVIDIA Corporation (NVDA): I Would Own, Not Trade",Insider Monkey,https://finance.yahoo.com/news/jim-cramer-nvidia-corporation-nvda-224331169.html,3.799
news,2024-10-25 16:38:00,"NVIDIA Corporation (NVDA) CEO Jensen Huang Confirms Design Flaw Caused Delays in Blackwell AI Chip Production, Set for Fourth Quarter Shipping",Insider Monkey,https://finance.yahoo.com/news/nvidia-corporation-nvda-ceo-jensen-203802952.html,1.696
news,2024-10-25 16:29:00,Nvidia And Other Chip Stocks Rise On Analyst Comments. These Are The Top Picks.,Investor's Business Daily,https://finance.yahoo.com/m/fff3e840-6fe5-3a06-8bdc-c30f10345d72/nvidia-and-other-chip-stocks.html,0.758
news,2024-10-25 15:45:00,Nvidia Stock Flirts With Buy Zone As Shares Near Fresh All-Time High,Investor's Business Daily,https://finance.yahoo.com/m/ebbb170d-b59c-3080-a3f0-43e08b0ca552/nvidia-stock-flirts-with-buy.html,0.0
news,2024-10-25 15:42:00,Nvidia Narrowly Misses Joining This Screen Of 18 Golden Gems,Investor's Business Daily,https://finance.yahoo.com/m/422d6d71-3f6d-36ca-9315-fb68a08b430a/nvidia-narrowly-misses.html,0.7
news,2024-10-25 15:29:00,Retail Investors Are Buying Up Nvidia and Other Single Stocks. Here's What That Means.,Investopedia,https://www.investopedia.com/retail-investors-nvidia-and-other-single-stocks-what-that-means-8734308,2.387
news,2024-10-25 14:59:00,"Nvidia Hits $3.50 Trillion, Poised to Overtake Apple's $3.53 Trillion Valuation",GuruFocus.com,https://finance.yahoo.com/news/nvidia-hits-3-50-trillion-185939184.html,3.79
news,2024-10-25 14:00:00,"Tesla, Nvidia-Led Market Rally Now Pressures Investment Funds To Offload Shares To Avoid US Tax Lawsuits",Benzinga,https://finance.yahoo.com/news/tesla-nvidia-led-market-rally-180016640.html,4.479
news,2024-10-25 12:43:00,"Where the Stock Market Is Headed Next, According to Our Exclusive Investor Survey",Barrons.com,https://finance.yahoo.com/m/ed10a665-85fb-3f03-bc97-068c50d5033e/where-the-stock-market-is.html,-0.296
news,2024-10-25 11:55:00,Nvidia overtakes Apple as world's most valuable company,Reuters,https://uk.finance.yahoo.com/news/nvidia-overtakes-apple-worlds-most-155501037.html,5
news,2024-10-25 11:03:00,"What's Going On With Nvidia, AMD And Other Chip Stocks On Friday?",Benzinga,https://finance.yahoo.com/news/whats-going-nvidia-amd-other-150314423.html,0.978
news,2024-10-25 10:30:00,Nvidia Stock Nears Record High Ahead of Big Tech Earnings,Barrons.com,https://finance.yahoo.com/m/0d0b681e-6377-3732-b257-8beff2c93c92/nvidia-stock-nears-record.html,0.0
news,2024-10-25 10:27:00,"Tesla's Stock Taps the Brakes, But It's Still Rising And So Is the Magnificent Seven",Investopedia,https://www.investopedia.com/tesla-stock-taps-the-brakes-but-its-still-rising-magnificent-seven-8734228,3.036
news,2024-10-25 09:58:00,Baron Opportunity Fund Trimmed NVIDIA Corporation (NVDA) as it Grew Overweight versus the Benchmark,Insider Monkey,https://finance.yahoo.com/news/baron-opportunity-fund-trimmed-nvidia-140009039.html,4.492
news,2024-10-25 05:03:00,Reflecting On Processors and Graphics Chips Stocks Q2 Earnings: Broadcom (NASDAQ:AVGO),StockStory,https://finance.yahoo.com/news/reflecting-processors-graphics-chips-stocks-090326298.html,1.697
news,2024-10-25 04:29:00,Nvidias billionaire CEO says AI can do a lot of thingsexcept take his job,Fortune,https://finance.yahoo.com/news/nvidia-billionaire-ceo-says-ai-082900997.html,0.178
news,2024-10-24 17:45:00,Nvidia (NVDA) Exceeds Market Returns: Some Facts to Consider,Zacks,https://finance.yahoo.com/news/nvidia-nvda-exceeds-market-returns-214520745.html,4.495
